{
  "project_id": "synthetic-project",
  "command_id": "126d5f3d-e768-421a-8b59-7613142476dc",
  "tasks": [
    {
      "task_id": "synthetic-ticket-one",
      "expected_revision": 3
    },
    {
      "task_id": "synthetic-ticket-two",
      "expected_revision": 7
    }
  ],
  "preview": true,
  "changes": {
    "kind": "tags",
    "add": [
      "synthetic-art"
    ],
    "remove": [
      "synthetic-regression"
    ]
  }
}
